{
  "slug": "potato",
  "version": 1,
  "status": "draft",
  "scientific_name": "Solanum tuberosum",
  "family": "Solanaceae",
  "names": {"en": "Potato", "si": "Ala", "ta": "Urulaikizhangu"},
  "aliases": ["ala", "urulaikizhangu"],
  "category": "vegetable",
  "life_cycle": "annual",
  "growth_habit": "herb",
  "soil_ph": {"min": 5.5, "max": 6.6},
  "spacing_cm": {"within_row": 25, "between_row": 60},
  "expected_yield_kg_per_acre": {"min": 8094, "max": 10117, "unit": "kg/acre"},
  "field_provenance": {
    "scientific_name": {"source_id": "doa", "source_url": "https://doa.gov.lk/hordi-crop-potato/", "fetched_at": "2026-04-17T00:00:00Z", "quote": "Solanum tuberosum"},
    "soil_ph": {"source_id": "doa", "source_url": "https://doa.gov.lk/hordi-crop-potato/", "fetched_at": "2026-04-17T00:00:00Z", "quote": "5.5-6.6", "review_notes": "DOA also advises 5.0–5.2 specifically for common scab management."},
    "spacing_cm": {"source_id": "doa", "source_url": "https://doa.gov.lk/hordi-crop-potato/", "fetched_at": "2026-04-17T00:00:00Z", "quote": "60 x 25 cm"},
    "expected_yield_kg_per_acre": {"source_id": "doa", "source_url": "https://doa.gov.lk/hordi-crop-potato/", "fetched_at": "2026-04-17T00:00:00Z", "quote": "20-25 t/ha", "review_notes": "20–25 t/ha → 8094–10117 kg/acre."}
  }
}
