{
  "slug": "chilli",
  "version": 1,
  "status": "draft",
  "scientific_name": "Capsicum annuum",
  "family": "Solanaceae",
  "names": {"en": "Chilli", "si": "Miris", "ta": "Milagai"},
  "aliases": ["chili", "chile pepper", "miris", "milagai"],
  "category": "vegetable",
  "life_cycle": "annual",
  "growth_habit": "shrub",
  "elevation_m": {"min": 0, "max": 1600, "unit": "m"},
  "temperature_c": {"min": 21, "max": 27, "unit": "°C"},
  "rainfall_mm": {"min": 600, "max": 1000, "unit": "mm"},
  "soil_ph": {"min": 5.5, "max": 6.8},
  "duration_days": {"min": 70, "max": 80, "unit": "days to first harvest after transplanting"},
  "spacing_cm": {"within_row": 45, "between_row": 60},
  "seed_rate_kg_per_acre": 0.405,
  "expected_yield_kg_per_acre": {"min": 4856, "max": 14164, "unit": "kg/acre fresh"},
  "field_provenance": {
    "scientific_name": {"source_id": "doa", "source_url": "https://doa.gov.lk/field-crops-chilli-si/", "fetched_at": "2026-04-17T00:00:00Z", "quote": "Capsicum annuum L."},
    "elevation_m": {"source_id": "doa", "source_url": "https://doa.gov.lk/field-crops-chilli-si/", "fetched_at": "2026-04-17T00:00:00Z", "quote": "Sea level to approximately 1,600 meters above sea level"},
    "temperature_c": {"source_id": "doa", "source_url": "https://doa.gov.lk/field-crops-chilli-si/", "fetched_at": "2026-04-17T00:00:00Z", "quote": "21°C – 27°C optimal"},
    "rainfall_mm": {"source_id": "doa", "source_url": "https://doa.gov.lk/field-crops-chilli-si/", "fetched_at": "2026-04-17T00:00:00Z", "quote": "600–1,000 mm annually in rain-fed areas"},
    "soil_ph": {"source_id": "doa", "source_url": "https://doa.gov.lk/field-crops-chilli-si/", "fetched_at": "2026-04-17T00:00:00Z", "quote": "pH value between 5.5-6.8"},
    "duration_days": {"source_id": "doa", "source_url": "https://doa.gov.lk/field-crops-chilli-si/", "fetched_at": "2026-04-17T00:00:00Z", "quote": "First harvest possible 70–80 days after transplanting"},
    "spacing_cm": {"source_id": "doa", "source_url": "https://doa.gov.lk/field-crops-chilli-si/", "fetched_at": "2026-04-17T00:00:00Z", "quote": "Single plant per mound: 60 cm rows × 45 cm within rows"},
    "seed_rate_kg_per_acre": {"source_id": "doa", "source_url": "https://doa.gov.lk/field-crops-chilli-si/", "fetched_at": "2026-04-17T00:00:00Z", "quote": "Open-pollinated: 1.0 kg/hectare; Hybrid varieties: 500 grams/hectare", "review_notes": "OP 1 kg/ha → 0.405 kg/acre."},
    "expected_yield_kg_per_acre": {"source_id": "doa", "source_url": "https://doa.gov.lk/field-crops-chilli-si/", "fetched_at": "2026-04-17T00:00:00Z", "quote": "Fresh chilli: 12–15 tons/hectare; Hybrid varieties: 30–35 tons/hectare", "review_notes": "12–35 t/ha → 4856–14164 kg/acre."}
  }
}
